,Title,Published_date,Views,Likes,View,Month
985,Tutorial 1- MySQL With Python And Data Science- MySQL Installation Steps,2020-09-09,127386,1796,127386,Sep
986,Why Domain Knowledge Is Important In Data Science?,2020-09-07,12250,622,12250,Sep
987,How To Train Deep Learning Models In Google Colab- Must For Everyone,2020-09-06,256833,4818,256833,Sep
988,Live - Data Science Q&A And Upcoming Videos Plan,2020-09-05,3145,228,3145,Sep
989,Machine Learning And Deep Learning Model Deployment Architecture Using TF Lite In Mobile,2020-09-05,11782,339,11782,Sep
990,Special Thanks To Youtube - Happy Teacher's Day Youtube,2020-09-05,2883,300,2883,Sep
991,Machine Learning And Deep Learning Model Deployment Architecture Using API's,2020-09-05,32021,899,32021,Sep
992,Live- Virtual Interview Session For Data Science- Session 8,2020-09-04,12165,435,12165,Sep
993,Live -Transformers Indepth Architecture Understanding- Attention Is All You Need,2020-09-03,136392,2972,136392,Sep
994,Data Science Is Just Not About Model Building,2020-09-03,13476,611,13476,Sep
995,Live -End To End Docker Implementation Of Data  Science Projects,2020-09-02,7727,299,7727,Sep
996,Debugging Server Side Application Using Python In Pycharm,2020-09-01,6050,197,6050,Sep
997,Live Virtual Interview Of Experienced For Data Scientist,2020-09-01,57036,1413,57036,Sep
998,"Tutorial 7-Build,Train,Deploy Machine Learning Model AWS SageMaker- Predicting Test Data Endpoints",2020-08-31,30939,510,30939,Aug
999,Live- Conversation With Data Structure And Algorithms Mentor For Free Community Session,2020-08-30,9905,382,9905,Aug
1000,"Tutorial 6-Build,Train,Deploy Machine Learning Model AWS SageMaker- Deployment Of Xgboost ML Model",2020-08-30,29443,487,29443,Aug
1001,"Tutorial 5-Build,Train, Deploy Machine Learning Model In AWS SageMaker-Training Xgboost ML ALgo",2020-08-30,36052,537,36052,Aug
1002,Live-How To Prepare Resume For Data Scientist As A Fresher,2020-08-29,54715,2558,54715,Aug
1003,"Tutorial 4-Build,Train, Deploy Machine Learning Model In AWS SageMaker- Uploading Files In S3 Bucket",2020-08-29,43445,614,43445,Aug
1004,"Tutorial 3-Build,Train, Deploy Machine Learning Model In AWS SageMaker- Creating S3 Buckets",2020-08-29,55766,842,55766,Aug
1005,"Tutorial 2-Build,Train, Deploy Machine Learning Model In AWS SageMaker- Creating Notebook Instance",2020-08-29,76302,1288,76302,Aug
1006,Live -Virtual Interview Of Fresher For Data Science - Session 6,2020-08-28,24927,710,24927,Aug
1007,Live- Exploring Nvidia RAPIDS- Open GPU Data Science,2020-08-27,7186,324,7186,Aug
1008,"Live- Attention Models, Transformers  In depth Intuition Deep Learning- Part 2",2020-08-26,33148,1075,33148,Aug
1009,AWS SageMaker For ML And DL Tutorial Playlist- What Will We Learn In This Playlist?,2020-08-26,94895,1949,94895,Aug
1010,Live Community Sessions Announcements- Covering All Technology Stack,2020-08-25,13840,753,13840,Aug
1011,Silhouette (clustering)- Validating Clustering Models- Unsupervised Machine Learning,2020-08-25,52632,1291,52632,Aug
1012,"Live Session- Encoder Decoder,Attention Models, Transformers, Bert Part 1",2020-08-24,65417,1723,65417,Aug
1013,Pytorch Tutorial 6- How To Run Pytorch Code In GPU Using CUDA Library,2020-08-24,55204,580,55204,Aug
1014,Live - Successful Transition Story Of SAP Consultant To Data Scientist,2020-08-23,22967,803,22967,Aug
1015,Live Project-Cotton Disease Prediction Deep Learning Live Project Implementation,2020-08-22,97500,2197,97500,Aug
1016,Live Virtual Interview For Data Science Fresher By Krish And Sudhanshu,2020-08-21,124592,3054,124592,Aug
1017,Live-Best Practices For Data Science Project Development|Session By Chief Technology Officer-Ineuron,2020-08-20,8508,277,8508,Aug
1018,Finally Built My Deep Learning And Gaming Workstation With Nvidia Titan RTX GPU 🔥🔥🔥🔥🔥- It's A Beast🔥,2020-08-20,29552,819,29552,Aug
1019,Live Session- Understanding Attention Models Architecture And Maths Intuition- Deep Learning,2020-08-19,50364,1321,50364,Aug
1020,Live Virtual Interview For Data Science- Background Applied Geology From IIT Kharagpur,2020-08-18,34761,946,34761,Aug
1021,Live Project Developing AI Advertisement Platform Using Deep Learning,2020-08-17,8661,290,8661,Aug
1022,Announcement For Give Away For Women Data Science Aspirants - Promoting Data Science,2020-08-16,6522,189,6522,Aug
1023,Live Q&A Data Science By Krish And Sudhanshu- Give Away For Women To Promote AI,2020-08-16,10956,377,10956,Aug
1024,Live Virtual Interview For Data Science From Teaching Assistant To Data Scientist,2020-08-14,19885,656,19885,Aug
1025,Live Project- Web Application - Loan Default Prediction- Masters Thesis,2020-08-13,26712,660,26712,Aug
1026,Live Interview Of Lakshay For Data Science- Commerce And Statistics Background,2020-08-12,23739,644,23739,Aug
1027,Nvidia Titan RTX Unboxing And Specs And Comparison- Deep Learning,2020-08-11,12372,422,12372,Aug
1028,Live Data Science Q&A With Krish And Sudhanshu- Give Away ML for Deployment+Internships For Women,2020-08-09,11322,473,11322,Aug
1029,Live Virtual Nervous Interview Of Mechanical Engineer For Data Science,2020-08-07,26934,435,26934,Aug
1030,Live- Discussion On Cross Validation Techniques And Selection of Machine Learning Algorithms,2020-08-06,9444,450,9444,Aug
1031,Live Transition Story Of Civil Engineer To Data Scientist With 2 Years Gap,2020-08-05,20532,748,20532,Aug
1032,Problems With Encoders And Decoders- Indepth Intuition,2020-08-05,29832,569,29832,Aug
1033,Step By Step Playlist To Follow To Learn Data Science Through My Channel - Part 2,2020-08-04,31441,1203,31441,Aug
1034,Live Virtual Interview For Data Science By Krish And Sudhanshu,2020-08-04,33461,891,33461,Aug
1035,Step By Step Playlist To Follow To Learn Data Science Through My Channel Part 1- Must for Everyone,2020-08-03,129051,5500,129051,Aug
1036,Live Discussion On Outlier And Its Impacts On Machine Learning UseCases,2020-08-02,48409,1966,48409,Aug
1037,Live Discussion On Handling Imbalanced Dataset- Machine Learning,2020-08-01,73557,2717,73557,Aug
1038,Live Virtual Interview For Internship For College Student By Krish And Sudhanshu,2020-07-31,47958,1395,47958,Jul
1039,Pytorch Tutorial 5-Live- Kaggle Advance House Price Prediction Using Pytorch Deep Learning,2020-07-30,17444,521,17444,Jul
1040,Live Virtual Interview For Data Science By Krish And Sudhanshu Part 2,2020-07-28,34624,972,34624,Jul
1041,Live In-depth Discussion Of PyCaret Automated Machine Learning Library Part 2,2020-07-27,5474,246,5474,Jul
1042,Live In-depth Discussion Of PyCaret Automated Machine Learning Library,2020-07-26,14249,482,14249,Jul
1043,Hyperparameter Tuning Techniques Genetic Algorithms And Optuna Data Science Machine Learning- Part 2,2020-07-25,16921,606,16921,Jul
1044,Live- Data Science Virtual Interview By Krish And Sudhanshu-Part 1,2020-07-24,91367,1801,91367,Jul
1045,Live-Discussing All Hyperparameter Tuning Techniques Data Science Machine Learning,2020-07-23,70672,2105,70672,Jul
1046,Live Q&A Data Science With Sudhanshu Kumar Part 2,2020-07-22,10536,396,10536,Jul
1047,Live-Charity Stream To Help Bihar And Assam Floods- My Special Journey To 200k subscribers,2020-07-21,6674,487,6674,Jul
1048,Live-Features Selection-Various Techniques To Select Features  Day 7,2020-07-20,54103,1524,54103,Jul
1049,Pytorch Tutorial 4- Solving Kaggle Pima Diabetes Prediction Using ANN With PyTorch Library,2020-07-20,22960,600,22960,Jul
1050,Live-Feature Engineering-All Standardization And Transformation Techniques- Day 6,2020-07-19,46570,1493,46570,Jul
1051,Live-Feature Engineering- Forecasting Time Series Using Facebook Fbprophet-Day 5,2020-07-18,21271,532,21271,Jul
1052,Summary Live Streaming-Feature Engineering- Probability Ratio Encoding- Handling Categorical Feature,2020-07-18,19277,456,19277,Jul
1053,Summary Live Q&A-Sudhanshu Journey On Data Science,2020-07-17,10170,505,10170,Jul
1054,Pytorch TutoriaL 3-How To Perform BackPropogation Using Pytorch,2020-07-17,13680,277,13680,Jul
1055,Live-Feature Engineering-All Techniques To Handle Categorical Features - Day 4,2020-07-16,46550,1413,46550,Jul
1056,Live-Feature Engineering-All Techniques To Handle Missing Values- Day 3,2020-07-15,58867,1602,58867,Jul
1057,Live-Feature Engineering-All Techniques To Handle Missing Values- Day 2,2020-07-14,63081,1879,63081,Jul
1058,Pytorch Tutorial 2-Understanding Of Tensors Using Pytorch,2020-07-14,21673,434,21673,Jul
1059,Live-Feature Engineering-All Techniques To Handle Missing Values- Day 1,2020-07-13,120045,3691,120045,Jul
1060,Live Unboxing MSI Laptop For Machine Learning And Deep Learning,2020-07-12,18862,341,18862,Jul
1061,Pytorch Tutorial 1-Pytorch Installation For Deep Learning,2020-07-12,52277,788,52277,Jul
1062,Live Discussion Of Roles And Responsibilities In Data Science Project- Further Announcements,2020-07-11,5951,419,5951,Jul
1063,Live- How To Approach Interviews For Data Science,2020-07-10,8508,613,8508,Jul
1064,Live- Implementation Of Malaria Disease Using Deep Learning End To End Projects With Deployment,2020-07-09,61337,1505,61337,Jul
1065,Live Summary- Memory Profiler In Python- How To Effectively Check Your Code Quality With Memory,2020-07-08,13454,254,13454,Jul
1066,Live- Implementation Of 7 HealthCare End To End Projects With Deployment,2020-07-08,81937,1933,81937,Jul
1067,Summary Recap Of Live Implementation Of Movie Recommendation With Deployment Using Heroku,2020-07-07,27097,724,27097,Jul
1068,Summary Of Live- Implementation Of Flight Fare Prediction Web App Project With Deployment,2020-07-07,12629,365,12629,Jul
1069,Live Implementation Of Movie Recommendation With Deployment Using Heroku,2020-07-06,120406,3652,120406,Jul
1070,Live- Implementation Of Flight Fare Prediction Web App Project With Deployment,2020-07-05,193097,6233,193097,Jul
1071,Live- Implementation of Cricket Score Prediction App With Deployment For IPL(Sport Analytics),2020-07-04,64424,2519,64424,Jul
1072,Summary of Live Discussion- Career Guidance For Freshers And Experienced In Data Science,2020-07-04,2862,199,2862,Jul
1073,Live Discussion- Career Guidance For Freshers And Experienced In Data Science,2020-07-03,10573,888,10573,Jul
1074,Live Discussion - How To Read Research Papers As A Data Scientist,2020-07-03,5510,251,5510,Jul
1075,Live Project-Stock Sentiment Analysis using News Headlines Machine Learning,2020-07-02,79337,2397,79337,Jul
1076,Live Session-Implementing Deep Learning Project From Scratch To Deployment- Heroku(Car Brand Class),2020-07-01,78508,1567,78508,Jul
1077,Live- Implementation of End To End Kaggle Machine Learning Project With Deployment,2020-06-30,584860,13766,584860,Jun
1078,Live-3 Weeks Big Data With Pyspark Community Classes Announcement For EveryOne For Free,2020-06-29,9654,456,9654,Jun
1079,Live Discussion - How To Read Text From Images Using Pytesseract,2020-06-29,41572,872,41572,Jun
1080,Live Discussion - How To Read Text From Images Using Pytesseract,2020-06-29,7007,229,7007,Jun
1081,Live Discussion - How To Read Research Papers As A Data Scientist,2020-06-28,5569,206,5569,Jun
1082,Live Discussion of Resume Of Data Scientist,2020-06-27,17163,542,17163,Jun
1083,Live Discussion of Resume Of Data Scientist,2020-06-27,4170,267,4170,Jun
1084,Encoder And Decoder- Neural Machine Learning Language Translation Tutorial With Keras- Deep Learning,2020-06-27,77502,1126,77502,Jun
1085,How To Prepare For Applying Freelancing Jobs For Data Science,2020-06-26,15332,604,15332,Jun
1086,Amazing Guidelines For Creating GitHub Profiles For Data Scientist,2020-06-25,34853,1160,34853,Jun
1087,Impact Of Artificial Intelligence On Employment- Data Science,2020-06-24,5960,243,5960,Jun
1088,Indian Paper Currency Predictor- Data Science Projects From Subscribers,2020-06-23,6148,209,6148,Jun
1089,Deployment Of Machine Learning PIPELINES Using Dockers and Kubernetes,2020-06-23,44075,850,44075,Jun
1090,Biggest Hurdles In AI Adoption Faced By Executives And Companies| Data Science,2020-06-22,2733,131,2733,Jun
1091,Live Q&A -  Future Videos To Come Regarding Data Science,2020-06-21,4112,147,4112,Jun
1092,All Automated Machine Learning Libraries At One Place- Project From Subscribers,2020-06-21,7248,315,7248,Jun
1093,Interesting Facts And Stats On Artificial Language,2020-06-20,2639,127,2639,Jun
1094,How To Debug Logs And Web Application In Heroku|Data Science,2020-06-20,35012,561,35012,Jun
1095,Building Automated Exploratory Data Analysis Project- Project From Subscriber,2020-06-20,13609,544,13609,Jun
1096,Important Point To Consider When Implementing Data Science Projects & Interviews-Must For Everyone,2020-06-19,5341,408,5341,Jun
1097,Twitter Tweet's Analyzer Using Streamlit Web App- Projects From Subscribers,2020-06-19,9141,262,9141,Jun
1098,Deploy Streamlit WebApp ML Models In Heroku(PAAS)- Data Science,2020-06-18,23738,480,23738,Jun
1099,The Correct Guidance To Learn Deep Learning Techniques|Sharing My Experience,2020-06-17,15871,913,15871,Jun
1100,Be Aware Of Data Science Job Description And Assignment,2020-06-16,17083,989,17083,Jun
1101,Sequence To Sequence Learning With Neural Networks| Encoder And Decoder In-depth Intuition,2020-06-16,108095,2287,108095,Jun
1102,Salary By Developer Type Based On Experience|Analyzing Stack Overflow Developer Survey 2020,2020-06-15,3133,98,3133,Jun
1103,Live Q&A  Data Science,2020-06-14,4426,141,4426,Jun
1104,How To Perform Post Pruning In Decision Tree? Prevent Overfitting- Data Science,2020-06-14,37123,864,37123,Jun
1105,Most Popular Databases Used By Professionals,2020-06-14,5228,154,5228,Jun
1106,"Most Loved, Dreaded And Wanted Programming Languages",2020-06-13,14297,140,14297,Jun
1107,Deploy Machine Learning Models Using StreamLit Library- Data Science,2020-06-13,95956,1508,95956,Jun
1108,Hummingbird-Run Traditional Machine Learning model on Deep Neural Network frameworks-Data Science,2020-06-13,17724,284,17724,Jun
1109,Develop Your First Deep Learning End To End Project As A Beginner In Data Science in 30 minutes,2020-06-12,42577,969,42577,Jun
1110,Give Away Results Of Abhishek Thakur New Books- Best Of Luck,2020-06-11,3905,151,3905,Jun
1111,4 End To End Projects Till Deployment For Beginners In Data Science| All You Have To Do Is Learn,2020-06-10,62168,2393,62168,Jun
1112,How To Convert Business Ideas And Opportunities Into Data Science Projects?,2020-06-10,6889,317,6889,Jun
1113,Is Age A Barrier To Get Into Data Science? Misconception,2020-06-09,19947,798,19947,Jun
1114,"Guidance Towards Data Science|Panel Discussion With Dhaval, Ken Jee And Data Professor",2020-06-08,13695,732,13695,Jun
1115,All You Want To Know About Kaggle-  Podcast With Abhishek Thakur Kaggle Grandmaster- Give Away Books,2020-06-07,30468,1468,30468,Jun
1116,Perform EDA In Seconds With Visualization Using SweetViz Library,2020-06-06,26936,1087,26936,Jun
1117,Tips For Resume Preparation For None Coding Background For Data Science- Podcast Summary,2020-06-06,4517,184,4517,Jun
1118,Free Statistics Community Live Classes For All|Initiative To Give To Data Science Community,2020-06-05,12049,633,12049,Jun
1119,Successful Transition From Finance Domain To Data Science- Author Of PyCaret| Podcast Summary,2020-06-05,2149,69,2149,Jun
1120,Should We Learn All Data Science LifeCycle Even Though We Have Automated Libraries|Author Of PyCaret,2020-06-05,2869,114,2869,Jun
1121,How To Read And Process Huge Datasets in Seconds Using Vaex Library| Data Science| Machine Learning,2020-06-04,24396,751,24396,Jun
1122,Perform Exploratory Data Analysis In Minutes- Data Science| Machine Learning,2020-06-03,70048,2140,70048,Jun
1123,Best Website Blogs For Data Science Tutorials|Important For Everyone,2020-06-02,10342,520,10342,Jun
1124,Julia Vs R Vs Python Programming Language For Data Science,2020-06-01,13940,372,13940,Jun
1125,Python Vs R Programming Language- Which One Should You Choose?,2020-05-31,15702,469,15702,May
1126,Top Data Science Communities to Join For Learning | Must For Making Transition To Data Science,2020-05-31,21095,640,21095,May
1127,StackOverflow Developer Survey 2020 Overview,2020-05-30,2207,75,2207,May
1128,Implement Kaggle Fake News Classifier Using Bidirectional LSTM RNN,2020-05-30,28012,621,28012,May
1129,Bidirectional RNN Indepth Intuition- Deep Learning Tutorial,2020-05-30,55186,1370,55186,May
1130,How To Contribute To Open Source Data Science Projects And Libraries,2020-05-29,15934,674,15934,May
1131,Blue Yeti Mic Unboxing - Best Mic For Youtube Videos Recordings,2020-05-28,1811,83,1811,May
1132,Data Science Vs Data Mining,2020-05-28,17950,568,17950,May
1133,Live Q&A DATA SCIENCE,2020-05-27,3364,103,3364,May
1134,Whether Data Science Is Becoming Software Engineering?,2020-05-26,7718,342,7718,May
1135,Stock Price Prediction And Forecasting Using Stacked LSTM- Deep Learning,2020-05-25,429972,7916,429972,May
1136,How To Create Your Own Brand As A Data Scientist? Yes You Can Do It,2020-05-24,9695,471,9695,May
1137,Conversation with the Author of PyCaret-Career Transition from Finance to Data Science,2020-05-24,5597,244,5597,May
1138,Lets Implement LSTM RNN Models For Univariate Time Series Forecasting- Deep Learning,2020-05-23,92399,1585,92399,May
1139,"Docker Tutorial 6- Writing, Building And Running Docker Image| Machine Learning",2020-05-23,38724,639,38724,May
1140,Why OOPS Concepts Is Must For Implementing Complex Data Science Projects,2020-05-22,12693,551,12693,May
1141,Did You Improve Your Productivity During This Lockdown?- Data Science - Sharing My Experience,2020-05-21,4652,228,4652,May
1142,Docker Tutorial 5- Understanding Docker Commands- Machine Learning,2020-05-21,28644,755,28644,May
1143,Atmanirbhar- Let's Become Specialized Data Scientist,2020-05-20,8765,608,8765,May
1144,Docker Tutorial 4-Docker Installation instructions In Windows And Other OS | Machine Learning,2020-05-20,33685,439,33685,May
1145,Kaggle Faker News Classifier Using LSTM- Deep LEarning| Natural Language Processing,2020-05-19,95077,1699,95077,May
1146,Successful Transition Story From Civil Engineer To A Data Scientist,2020-05-18,44102,1201,44102,May
1147,Live Q&A Data Science,2020-05-17,11693,374,11693,May
1148,Please Help Each Other To Pass This Crisis- Motivation(Important For Everyone),2020-05-17,2145,173,2145,May
1149,Docker Tutorial 3-Deploying Machine Learning Models Using Flask And Flasgger,2020-05-17,44517,781,44517,May
1150,Docker Tutorial 2- Building A Flask App For A Bank Note Authentication,2020-05-16,59992,1300,59992,May
1151,Successful Transition Story From Mechanical Engineer To A Data Scientist,2020-05-16,51207,1539,51207,May
1152,How To Stay Relevant in Data Science Industry- Sharing My Experience,2020-05-15,5468,308,5468,May
1153,"Docker Tutorial 1- Why and What is Docker, Dockers Containers, Virtualization In Machine Learning",2020-05-14,114837,3036,114837,May
1154,Gradient Boosting Complete Maths Indepth Intuiton Explained| Machine Learning- Part2,2020-05-14,92167,1970,92167,May
1155,Neural Network 3d Visualization Framework- Deep Learning,2020-05-13,4749,233,4749,May
1156,Develop your Neural Network Like A Google Deep Learning Developer,2020-05-12,33956,1348,33956,May
1157,Gradient Boosting In Depth Intuition- Part 1 Machine Learning,2020-05-11,176391,3743,176391,May
1158,Feedback Regarding The Initiative To Give Back To The Data Science Community- Ft: Ineuron,2020-05-10,2680,156,2680,May
1159,Implementing Word Embedding Using Keras- NLP | Deep Learning,2020-05-10,87086,1840,87086,May
1160,Machine Learning Challenge Or Competition For EveryOne Ft: Ineuron,2020-05-09,5152,197,5152,May
1161,My Laptop Lenovo Legion Y 540 Performance After Using 1 Month,2020-05-09,37061,925,37061,May
1162,Word Embedding - Natural  Language Processing| Deep Learning,2020-05-08,145592,3335,145592,May
1163,FAKE NEWS CLASSIFIER WITH MACHINE LEARNING ALGORITHMS USING Natural Language Processing- PART 2,2020-05-08,32191,491,32191,May
1164,FAKE NEWS CLASSIFIER WITH MACHINE LEARNING ALGORITHMS USING Natural Language Processing- PART 1,2020-05-07,90254,1381,90254,May
1165,Free Data Science Project Architecture And Resume Building Sessions- Giving Back To DS Community,2020-05-06,11204,599,11204,May
1166,All About Recessions And Its Impact Due To These Recent Events,2020-05-05,6695,314,6695,May
1167,Machine Learning-Bias And Variance In Depth Intuition| Overfitting Underfitting,2020-05-04,242019,7049,242019,May
1168,Who Are My Channel Audience? (Important Message For Everyone),2020-05-03,10861,989,10861,May
1169,Natural Language Processing|TF-IDF Intuition| Text Prerocessing,2020-05-02,223549,6042,223549,May
1170,Natural Language Processing|Bag Of Words Intuition,2020-05-02,166688,3557,166688,May
1171,Natural Language Processing| Stemming And Lemmatization Intuition,2020-05-02,122109,2782,122109,May
1172,Maths Intuition Behind Support Vector Machine Part 2 | Machine Learning Data Science,2020-05-02,192671,5173,192671,May
1173,Are Certification Necessary For Data Science?,2020-05-01,30042,1497,30042,May
1174,How To Develop Multi Output Regression Models With Python- Machine Learning,2020-05-01,21105,390,21105,May
1175,Impacts On Hiring For Jobs Due To The Recent Events,2020-04-30,12011,574,12011,Apr
1176,Hottest Domains To Work To Get Into Data Science Careers,2020-04-29,20708,902,20708,Apr
1177,Support Vector Machine (SVM) Basic Intuition- Part 1| Machine Learning,2020-04-28,345285,8036,345285,Apr
1178,How To visualize Decision Tree In Random Forest- Machine Learning,2020-04-28,14691,271,14691,Apr
1179,Easy Way To Visualize Decision Tree- Machine Learning Algorithm,2020-04-27,21182,415,21182,Apr
1180,Automate Anomaly Detection Using Pycaret -Data Science And Machine Learning,2020-04-27,34234,726,34234,Apr
1181,Who Is The Best Person To Judge You? Motivational Talks,2020-04-26,3277,277,3277,Apr
1182,Live Q&A Data Science,2020-04-26,5207,207,5207,Apr
1183,Free Python Live Sessions For Data Science-  Initiative To Give Back To Data Science Community,2020-04-25,11448,443,11448,Apr
1184,Step By Step Process To Learn Machine Learning Algorithm Efficiently,2020-04-24,66745,2918,66745,Apr
1185,Do Not Memorize Code In Data Science. Just Google It(Important For Freshers And Experienced),2020-04-23,37804,2279,37804,Apr
1186,Giving Back To The Data Science Community Initiative- Free Tableau and Power BI Live Sessions,2020-04-22,17269,716,17269,Apr
1187,Tutorial 49- How To Apply Naive Bayes' Classifier On Text Data (NLP)- Machine Learning,2020-04-21,105172,2160,105172,Apr
1188,Tutorial 48- Naive Bayes' Classifier Indepth Intuition-  Machine Learning,2020-04-20,289140,6961,289140,Apr
1189,Tutorial 47- Bayes' Theorem| Conditional Probability- Machine Learning,2020-04-19,272236,5325,272236,Apr
1190,Solving Kaggle Credit Card Fraud Detection Using Pycaret Library- Data Science,2020-04-18,20397,533,20397,Apr
1191,Sharing My Experience- How Teaching Has Improved My Data Science Skills,2020-04-17,2143,175,2143,Apr
1192,Automate LifeCycle Of Data Science Projects By Using This Open Source Library,2020-04-14,12056,422,12056,Apr
1193,Teachable  Machine By Google- Train Your Model With Ease,2020-04-13,16094,399,16094,Apr
1194,How to Build A Data Science Portfolio That Can Get You Jobs?,2020-04-12,56729,2620,56729,Apr
1195,Live Q&A Data Science,2020-04-12,3720,169,3720,Apr
1196,Tutorial 42-How To Find Optimal Threshold For Binary Classification - Data Science,2020-04-11,68906,1363,68906,Apr
1197,How Should You Explain Your Data Science Projects To Recruiters?- Must Watch For Everyone,2020-04-10,89817,3876,89817,Apr
1198,Tutorial 12 PowerQuery DateTime Functions,2020-04-10,4921,78,4921,Apr
1199,Tutorial 11 PowerQuery Merge Queries,2020-04-10,3893,66,3893,Apr
1200,Tutorial 10 PowerQuery Append Queries,2020-04-10,4117,60,4117,Apr
1201,Tutorial 9 - PowerQuery Text Transformation,2020-04-10,5185,67,5185,Apr
1202,Tutorial 8-Power Query Add And Transform Column,2020-04-10,5962,72,5962,Apr
1203,Tutorial 7- Data Types In PowerBI,2020-04-10,7905,98,7905,Apr
1204,Tutorial 6- Introduction And In Depth Understanding of Power Query(ETL),2020-04-10,11074,129,11074,Apr
1205,Tutorial 5- Introduction To Power BI Desktop,2020-04-10,9638,106,9638,Apr
1206,Tutorial 4- Power BI Installation,2020-04-10,8963,92,8963,Apr
1207,Tutorial 3- Introduction To Power BI,2020-04-10,9545,98,9545,Apr
1208,Tutorial 2- What Is Business Intelligence?,2020-04-10,13171,149,13171,Apr
1209,Tutorial 1 Power BI Course Overview. What All We Will Learn?,2020-04-10,34299,411,34299,Apr
1210,Feature Engineering-How to Transform Data to Better Fit The Gaussian Distribution-Data Science,2020-04-09,26152,681,26152,Apr
1211,My Recording Gears For Data Science Videos,2020-04-07,4806,233,4806,Apr
1212,Tutorial 7- FAQ Chatbot Using RASA NLU- Conclusion and Further Work,2020-04-06,4738,66,4738,Apr
1213,Tutorial 6- FAQ Chatbot Using RASA NLU- Telegram Integration,2020-04-06,9296,82,9296,Apr
1214,Tutorial 5- FAQ Chatbot Using RASA NLU- FAQ Chatbot Implementation,2020-04-06,11861,86,11861,Apr
1215,Tutorial 4- FAQ Chatbot Using RASA NLU- FAQ Problem Statement,2020-04-06,7553,47,7553,Apr
1216,Tutorial 3- FAQ Chatbot Using RASA NLU- Introduction To RASA,2020-04-06,17690,143,17690,Apr
1217,Tutorial 2- FAQ Chatbot Using RASA NLU- Chatbot Introduction,2020-04-06,13965,80,13965,Apr
1218,Tutorial 1- FAQ Chatbot Using RASA NLU,2020-04-06,24527,152,24527,Apr
1219,Why Domain Knowledge Is Important For Data Scientist?,2020-04-05,3785,182,3785,Apr
1220,How Do I Learn Complex Topics In Machine Learning And Deep Learning?,2020-04-04,5575,318,5575,Apr
1221,Tableau Tutorial BI- Bar Graph KPI,2020-04-01,4965,51,4965,Apr
1222,Tableau Tutorial BI- Market Basket Analysis,2020-04-01,8172,82,8172,Apr
1223,Tableau Tutorial BI- Sunburst Pie Charts,2020-04-01,7175,58,7175,Apr
