,Title,Published_date,Views,Likes,View,Month
0,Live Q&A After Long Time- Krish Naik,2023-10-15,3637,274,3637,Oct
1,"Complete ML,DL,NLP And Computer Vision Project Guide With Free Videos And Materials",2023-10-12,40979,1380,40979,Oct
2,Complete Python Guide And 500+ Interview Questions And Solution With Usecases,2023-10-08,35308,1415,35308,Oct
3,"Complete End to End Deep Learning Project With MLFLOW,DVC And Deployment",2023-10-06,16649,495,16649,Oct
4,3 Things To Improve To Crack Data Science Interview-Tips From Success Stories-Krish Naik,2023-10-05,13402,453,13402,Oct
5,MLOPS-Machine Learning Production Grade Deployment Technqiues With MLOPS In One Shot,2023-10-03,9415,327,9415,Oct
6,Mock Interviews For Data Science And Data Analyst,2023-10-02,15590,506,15590,Oct
7,Complete Statistics Guide With Usecases and Scenario Based Interview Questions With Solutions,2023-09-30,13309,480,13309,Sep
8,"Complete MySQL Guide-Interview Questions With Answers,Cheatsheet,Handwritten Notes Including Videos",2023-09-25,19185,540,19185,Sep
9,"Complete Data Science And Data Analytics Guide-Cheatsheet,Handwritten Notes Including Videos",2023-09-21,67944,2430,67944,Sep
10,Question Of The Decade? Is DSA Required For Data Science? #dsa #datascience,2023-09-18,23309,621,23309,Sep
11,Benq Sent Me This Amazing Monitor For Coding|BenQ GW2790QT| Eye-Care Programming Monitor,2023-09-17,4548,96,4548,Sep
12,"ML Series-Step By Step ML Project Implementation-EDA,FE,Feature Selection,Model Training #day10",2023-09-16,13708,425,13708,Sep
13,"ML Series-Complete Ridge, Lasso & ElasticNet Machine Learning Algorithms Hand Written Notes #day10",2023-09-15,5584,112,5584,Sep
14,The Most Common Mistakes While Applying Data Science Jobs,2023-09-13,10572,464,10572,Sep
15,Do and Dont's Before Attending Data Science Interviews- Dont Make These Crucial Mistakes,2023-09-11,14618,682,14618,Sep
16,Is Linkedin The Best Platform For Applying Data Science Jobs #datascience,2023-09-08,17582,657,17582,Sep
17,Importance of following process while learning data science #artificialintelligence #mlprojects,2023-09-07,5430,206,5430,Sep
18,From Faculty to Data Science Thrilling Journey #mlprojects,2023-09-06,4719,138,4719,Sep
19,This 8 minutes Story Will Change Your Life,2023-09-05,23232,1404,23232,Sep
20,ML Series-Polynomial Regression Theory & Implementation Pipelines From Basic To Advanced#day9,2023-09-03,7977,211,7977,Sep
21,Lets Celebrate-Launch of PSLV-C57/Aditya-L1 Mission,2023-09-02,4784,185,4784,Sep
22,ML Series 2023-Simple & Multiple Linear Regression Implementation From Basic To Advanced#day8,2023-09-01,11774,331,11774,Sep
23,Standout With Additional Skillsets In Data Science Interviews #ai #mlprojects #datascience #skills,2023-08-25,8691,409,8691,Aug
24,How To Apply For Data Science Jobs? #mlprojects #datascience #machinelearning,2023-08-24,9884,433,9884,Aug
25,48 Years Old Transition From Faculty To Data Science- Hear Our Kishor Sir Story @PWSkillsTech,2023-08-24,11689,244,11689,Aug
26,Essential Guide To Data Science Self Study #shorts  #ai #datascience #mlprojects #transition,2023-08-23,15783,729,15783,Aug
27,Mastering Machine Learning Algorithms:The Secret Technique for Interview Success #ai #datascience,2023-08-22,6897,446,6897,Aug
28,Evidently AI Tutorial-Open Source ML Models Monitoring and Observability,2023-08-21,8772,294,8772,Aug
29,Is Transition From Mechanical Engineering To Data Science Possible? Shivam Transition Story Podcast,2023-08-18,13558,212,13558,Aug
30,BentoML Tutorial: Build Production Grade AI Applications,2023-08-16,10127,346,10127,Aug
31,Rohan Successful Transition-Freshers To MLOPS Lead With Equity @PWSkillsTech #datascience #ai,2023-08-14,9255,150,9255,Aug
32,Projjal Transition Story To Data Science With 380% Hike,2023-08-11,14417,319,14417,Aug
33,Tanisha Transition Story To Data Analytics Industry With 200% Hike,2023-08-03,27511,431,27511,Aug
34,Tavishi Transition Story To Data Science With 6 Offers And  170% Hike @PWSkillsTech,2023-07-30,70098,1376,70098,Jul
35,End To End MLOPS Data Science Project Implementation With Deployment,2023-07-28,29621,819,29621,Jul
36,Data Versioning Hands On Tutorials With DVC For Data Science,2023-07-25,10038,262,10038,Jul
37,The Power Of MLFLOW And Dagshub-Open Source Data Science Project Collaboration,2023-07-23,16265,473,16265,Jul
38,Live- Discussing Recent Development In Generative AI,2023-07-21,7280,217,7280,Jul
39,Will AI Eat Your Job After ChatGPT And Code Interpreter- What You Should Do?,2023-07-17,15079,466,15079,Jul
40,The Power Of ChatGPT Plugins|Check This Powerful Demo,2023-07-15,7266,167,7266,Jul
41,The Future Of Coding-Code Interpreter With Chatgpt- Its Time To Make AI Your Friend,2023-07-11,35602,665,35602,Jul
42,What Will Change In Data Science Project Development After OPENAI And Hugging Face API,2023-07-10,19637,574,19637,Jul
43,Why You Should Learn Python In 2023 And Focus On Project Development?,2023-07-06,16561,450,16561,Jul
44,A Dedicated Playlist For End To End Data Science Projects Implementation With Deployment In 2023,2023-07-04,22085,674,22085,Jul
45,The Power Of Function Calling Ussing OpenAI API Tutorial #2,2023-07-03,8880,143,8880,Jul
46,OpenAI API With Python Tuorial 1-ChatCompletion API and Completion API,2023-06-30,19149,436,19149,Jun
47,End To End Machine Learning Project Implementation Using AWS Sagemaker,2023-06-24,41381,881,41381,Jun
48,This Video Has Been Made By An AI With My Avatar- Future OF AI,2023-06-22,16208,523,16208,Jun
49,Learn How Python Data Classes Can Save Your Time In Projects,2023-06-21,13423,471,13423,Jun
50,Build Python LLM apps in minutes Using Chainlit ⚡️,2023-06-18,22180,533,22180,Jun
51,How OpenAI Will Change the Future- Sharing My Experience After Using It,2023-06-16,11427,361,11427,Jun
52,Learn How To Query Pdf using Langchain Open AI in 5 min,2023-06-16,24479,505,24479,Jun
53,Prompt Engineering And LLM's With LangChain In One Shot-Generative AI,2023-06-15,23937,466,23937,Jun
54,Getting Started With LangChain In 20 Minutes- Build Celebrity Search Application,2023-06-13,47235,1489,47235,Jun
55,An Important Advice-AI Is Advancing Just Start Learning AI Before Its Late,2023-06-11,31405,1226,31405,Jun
56,What Is Generative AI,2023-06-10,57833,1863,57833,Jun
57,Machine Learning Series-Linear Regression Ordinary Least Square Method,2023-06-09,9504,137,9504,Jun
58,"Machine Learning Series- Revising Regression Performance Metrics,MSE,MAE,RMSE, R squared-Krish Naik",2023-06-08,8593,185,8593,Jun
59,"Machine Learning Series- Revising Complete Linear Regression,Cost Function,Convergence Algorithm",2023-06-06,16955,402,16955,Jun
60,Complete Anomaly Detection Tutorials Machine Learning And Its Types With Implementation | Krish Naik,2023-06-06,21293,532,21293,Jun
61,End To End Deep Learning Project Using MLOPS DVC Pipeline With Deployments Azure And AWS- Krish Naik,2023-06-03,74143,1446,74143,Jun
62,Aws Activate for Startups! #shorts,2023-06-01,12300,674,12300,Jun
63,End To End NLP Project Implementation With Deployment Github Action- Text Summarization- Krish Naik,2023-05-28,68554,1435,68554,May
64,"Very Good News For Startups- AWS Activate A Program to Support Startups, Founders, & Entrepreneurs",2023-05-27,39083,195,39083,May
65,Inside ChatGPT: Unveiling the Training Process of OpenAI's Language Model,2023-05-26,26047,678,26047,May
66,Is Google Bard Better Than ChatGPT? You Decide By Seeing These Major Differences,2023-05-24,8792,229,8792,May
67,All you Need To Know About Mojo Programming Language,2023-05-06,43860,979,43860,May
68,Can ChatGPT Take A Company Down?,2023-05-03,13881,250,13881,May
69,This Topic Is Most Important To Learn In Linear Algebra For Machine Learning #day4,2023-05-02,10505,258,10505,May
70,Late Night Talks- Live Q&A- Lets See Who Are Awake,2023-04-29,7304,386,7304,Apr
71,Machine Learning Series-Instance Based vs Model Based Learning#day3,2023-04-22,14447,425,14447,Apr
72,Machine Learning Series- Demystifying Machine Learning Algorithms #Day2,2023-04-20,18079,578,18079,Apr
73,Machine Learning Series- Universe of Data Science #Day1,2023-04-18,29615,1204,29615,Apr
74,Announcing New Fresh Machine Learning And NLP Community Sessions,2023-04-17,34085,1648,34085,Apr
75,Live After A Long Time- Lets Talk About Updates On Data Science,2023-04-15,6930,288,6930,Apr
76,Tutorial 12- Step By Step Production Grade Machine Learning Projects Deployment Azure Web App MLOPS,2023-04-13,10036,176,10036,Apr
77,Tutorial 11- How To Deploy End To End ML Projects In Production AWS Cloud Using CI CD Pipeline,2023-04-09,22252,489,22252,Apr
78,Tutorial 10- Deployment Of ML Application In Azure Cloud Using Github Actions,2023-03-31,17375,692,17375,Mar
79,Complete Dockers For Data Science Tutorial In One Shot,2023-03-29,69184,1720,69184,Mar
80,End To End Data Science Project Implementation In One Shot- Part 1,2023-03-26,58887,1677,58887,Mar
81,Judging India's Largest Hackathon @physicswallah,2023-03-20,23558,638,23558,Mar
82,Tutorial 9-End To End ML Project-Deployment In AWS Cloud Using CICD Pipelines,2023-03-18,30524,662,30524,Mar
83,Tutorial 8-End To End ML Project-Create Prediction Pipeline Using Flask Web APP,2023-03-16,24101,518,24101,Mar
84,Tutorial 7-End To End ML Project-Model Hyperparameter Tuning,2023-03-14,15491,349,15491,Mar
85,Tutorial 6-End To End ML Project-Model Training And Model Evaluating Component,2023-03-13,19449,665,19449,Mar
86,Tutorial 5-End To End ML Project-Data Transformation Implementation Using Pipelines,2023-03-11,25267,567,25267,Mar
87,Tutorial 4-End To End ML Project With Deployment- Data Ingestion Implementation Line By Line,2023-03-10,29066,615,29066,Mar
88,"Tutorial 3-End To End ML Project With Deployment-Project Problem Statement,EDA And Model Training",2023-03-09,47526,1397,47526,Mar
89,"Tutorial 2- End To End ML Project With Deployment-Project Structure, Logging And Exception Handling",2023-03-07,54909,1436,54909,Mar
90,Inviting You To RAJASTHAN IT Online And Offline HACKATHON Powered By  @PhysicsWallah,2023-03-06,7300,183,7300,Mar
91,Tutorial 1- End To End ML Project With Deployment-Github And Code Set Up,2023-03-05,211508,3198,211508,Mar
92,Now you Can Crack Any ML Interviews- Announcing 7 Days End To End ML Project With Deployment,2023-03-04,421227,3207,421227,Mar
93,How ChatGPT Can Be Wrong About Me?,2023-02-27,8051,201,8051,Feb
94,When Your Kid Doesnt Want You To Work-Just For Fun with @krishivnaikvlogs8998,2023-02-24,29159,867,29159,Feb
95,Changes Is Inevitable And You Need To Change With Time,2023-02-24,12041,535,12041,Feb
96,"Watch This Video To Crack Any Stats Interview For Data Scientist- Understanding PDF,PMF and CDF",2023-02-23,35083,1296,35083,Feb
97,What Is Derivatives In  Calculus In Layman Terms?,2023-02-21,4672,204,4672,Feb
98,How Prakhar Cracked Multiple Job Offers In Data Science,2023-02-20,9303,266,9303,Feb
99,How Jaiyesh Cracked Data Science Job In Siemens From Petroleum Engineering @iNeuroniNtelligence,2023-02-16,6417,154,6417,Feb
100,Will Chatgpt Kill Your Creativity?,2023-02-15,6082,219,6082,Feb
101,Successful Data Science Career Transition Of Shiva To Cisco With High Package @iNeuroniNtelligence,2023-02-14,6031,159,6031,Feb
102,How Raghav Got 6 Offers In Data Science Coming From Non Technical Domain @iNeuroniNtelligence,2023-02-13,17522,569,17522,Feb
103,"Sucessful Transition Story From Mechanical Eng ,UPSC Aspirant To Data Analyst Apprentice At Google",2023-02-12,8080,212,8080,Feb
104,Can We Earn More From FreeLancing Than Full time Jobs? Steps To Start Your Free Lancing Career,2023-02-09,11206,351,11206,Feb
105,Google Chatbot Alternative To ChatGPT- Who Will Win?,2023-02-06,16913,393,16913,Feb
106,Machine Learning Playlist For Interviews #shorts,2023-02-05,22455,1563,22455,Feb
107,How To Build Ideas For Real World Data Science Projects For Interviews,2023-02-04,15270,612,15270,Feb
108,You Know Your Strength And You Are Unique #shorts,2023-02-03,10615,956,10615,Feb
109,Patience And Practise Is The Key to Learn Anything,2023-02-01,25829,2025,25829,Feb
110,Will ChatGPT Take Our Jobs? #shorts,2023-01-31,17953,967,17953,Jan
111,Reality Of Data Science Work- What We Learn Vs What We Work In Industries,2023-01-31,37834,1497,37834,Jan
112,AvgWord2vec Indepth Intuition And Practical Implementation,2023-01-29,7042,147,7042,Jan
113,Exponential Learning #shorts,2023-01-28,15515,1246,15515,Jan
114,Lets Talk And Chat!! Live Q&A,2023-01-27,6666,409,6666,Jan
115,Why Big Tech Companies Are Facing Massive Layoffs?,2023-01-26,35362,776,35362,Jan
116,"Word Embeddings, Word2Vec And CBOW Indepth Intuition And Working- Part 1 | NLP For Machine Learning",2023-01-25,13762,296,13762,Jan
117,Demo Of AI Powered Nvidia Broadcast Eye Contact,2023-01-24,10915,211,10915,Jan
118,My Thoughts On Recent Layoffs And Recession,2023-01-22,56642,1352,56642,Jan
119,Live From DUBAI,2023-01-20,10627,308,10627,Jan
120,These Robots Are Really Smart|Museum Of the Future|Dubai #shorts,2023-01-18,21751,989,21751,Jan
121,PCA Indepth Geometric And Mathematical InDepth Intuition ML Algorithms,2023-01-18,38568,940,38568,Jan
122,I Used Chatgpt To Create My Own Private Web Browser,2023-01-16,20513,487,20513,Jan
123,Data Collection Stratergy For Machine Learning Projects With API's- RapidAPI,2023-01-15,22626,691,22626,Jan
124,Why To Choose Data Science As A Career In 2023?,2023-01-13,33984,1201,33984,Jan
125,Just Change Your Approach,2023-01-12,27267,1969,27267,Jan
126,The Ultimate 2023 Data Analyst Roadmap: From Zero to Hero|Krish Naik,2023-01-11,78832,2577,78832,Jan
127,Top 6 CI/CD Tools for MLOPS Engineers,2023-01-09,6924,231,6924,Jan
128,6 Months Data Science RoadMap 2023,2023-01-07,111015,3590,111015,Jan
129,Create Amazing Data Science Resume Using ChatGPT- Try It Out,2023-01-06,26731,753,26731,Jan
130,Amazing Data Science Content In 2023,2023-01-05,17971,740,17971,Jan
131,Amazing Things That ChatGPT Can Do!!,2022-12-28,17002,413,17002,Dec
132,Last Live Q&A Of 2022- Ask Me All your Queries,2022-12-27,7794,403,7794,Dec
133,A New Revolution For Tech Education | Democratizing The Future of Education,2022-12-25,22645,477,22645,Dec
134,One Thing You Need To Acquire To Learn Any Technology- Must Watch,2022-12-04,19036,876,19036,Dec
135,Live Q&A- Amazing Community Courses Announcement- Ask Me Anything,2022-11-25,6612,317,6612,Nov
136,Black Friday Sales 50% off On All Courses And Mobile App Announcement @iNeuroniNtelligence,2022-11-25,14132,156,14132,Nov
137,All Possible Ways To Apply Jobs In Data Science Industry,2022-11-17,31642,1157,31642,Nov
138,Companies That Are Hiring Aggressively For Data Science or Data Analytics Roles,2022-11-12,76625,2692,76625,Nov
139,Best MLOPS Architecture For Data Science Projects,2022-11-11,16373,444,16373,Nov
140,Full Stack Data Analytics 2.0 Live Batch- Best Course For Data Analyst,2022-11-10,13921,203,13921,Nov
141,When Are We Launching iNeuron Mobile App- Both IOS And Android,2022-11-08,84084,271,84084,Nov
142,Is Recession Coming? What You Should Do?,2022-11-06,127659,2942,127659,Nov
143,Don't Panic While Learning Data Science😨😨😨😨,2022-11-04,46228,2047,46228,Nov
144,Now Developing Your Deep Learning Application Is Easy Using Neurolab,2022-11-03,8138,219,8138,Nov
145,I have Become A Recording Machine For Data Science 😎😎😎😎,2022-11-01,16195,706,16195,Nov
146,ML Project Implementation And Deployment Using NeuroLab @iNeuroniNtelligence,2022-10-31,10074,228,10074,Oct
147,NeuroLab Virtual Coding Lab Is Live🌟🌟 - Live Demo @iNeuroniNtelligence,2022-10-28,15998,769,15998,Oct
148,The Best Course For Data Science Starters With Neuro Lab @iNeuroniNtelligence,2022-10-27,10339,219,10339,Oct
149,We Are Working Hard For The Virtual Lab @iNeuroniNtelligence Happy Diwali All,2022-10-24,16002,358,16002,Oct
150,Live Testing Of NeuroLab- Free Coding Platform For All,2022-10-22,17845,418,17845,Oct
151,Need All Your Help To Test NeuroLabs Coding Platform  Today At 6pm,2022-10-22,6045,249,6045,Oct
152,Scikit-Learn and Hugging Face Bhai Bhai👬👬,2022-10-20,9140,285,9140,Oct
153,The Best Course For Data Analyst,2022-10-19,16442,292,16442,Oct
154,We Have An Amazing Gift For Every Developers And Coders @iNeuroniNtelligence,2022-10-17,208983,4901,208983,Oct
155,Live Full Stack Data Analytics Bootcamp 2.0 Course For Data Analyst @iNeuroniNtelligence,2022-10-16,16270,314,16270,Oct
156,Power Of Internship For Your First Data Science Job- Transition Story Of Rohan,2022-10-15,19203,918,19203,Oct
157,RoadMap For 30 Days Data Science Interview Preparation With Materials @iNeuroniNtelligence,2022-10-14,22082,2119,22082,Oct
158,@GitHub Sent Me These Amazing Gifts As A Github Star 🌟,2022-10-13,8732,255,8732,Oct
159,Resume Discussion To Crack Data Science Jobs For Freshers- Just Follow The Process,2022-10-09,67204,2075,67204,Oct
160,Live Q&A-Data Science Jobs-Ask Anything Related To Data Science,2022-10-06,9769,294,9769,Oct
161,Navaratri Celebration In iNeuron😇😇,2022-10-04,19637,336,19637,Oct
162,New Research-How To Stay Updated In AI-Action And Text To Motion Models Using AI,2022-10-04,5415,166,5415,Oct
163,Do Not Miss This Opportunity From @iNeuroniNtelligence - Start Getting Skilled,2022-10-02,10520,179,10520,Oct
164,Amazing AI Use Cases-Google Cloud ML Increases On Time Flight Using Wind Forecasting,2022-09-30,10830,251,10830,Sep
165,Complete RoadMap To Learn AIOPS or MLOPS,2022-09-27,47261,1439,47261,Sep
166,This Is How We Teach In Ineuron: Introduction Session Industry Ready Projects,2022-09-25,25356,305,25356,Sep
167,Live Q&A-Ask Anything Related To Data Science,2022-09-22,10908,370,10908,Sep
168,Data Science Industry Ready Project Course Announcement For Everyone-24th September,2022-09-21,16020,470,16020,Sep
169,30 Days Live Data Science Interview Preparation Induction Session,2022-09-19,14264,482,14264,Sep
170,Detailed Interview Process To Crack FAANG Companies- Ft:@PriyaBhatia,2022-09-19,7031,237,7031,Sep
171,Roadmap To Crack Your First Data Science Job,2022-09-17,25811,1023,25811,Sep
172,Detailed Roadmap To Learn Data Stuctures And Algorithms Ft: @PriyaBhatia,2022-09-15,22292,712,22292,Sep
173,Data Science Jobs And Salary Are Booming!! Watch This Video To Know How?,2022-09-14,27153,1022,27153,Sep
174,How 5  Years Career Gap Student Made A Transition to Data Science- Ft: @iNeuroniNtelligence,2022-09-12,28132,944,28132,Sep
175,Live Q&A- Ask Anything Related Data Science,2022-09-11,10283,383,10283,Sep
176,Last Day To Avail 30% off On All Courses @iNeuroniNtelligence,2022-09-11,4217,75,4217,Sep
177,Why Statistics Is Super Important For Data Science? Must Watch,2022-09-08,14711,455,14711,Sep
178,Solving FAANG DSA Interview Questions With Its Implementation,2022-09-08,8201,173,8201,Sep
179,End To End Data Science Industry Ready Projects Course Announcement- Be Industry Ready⭐⭐⭐⭐,2022-09-07,16409,384,16409,Sep
180,Neuro Labs Demo-Dont Worry About High Configuration Laptops @iNeuroniNtelligence​,2022-09-07,8265,217,8265,Sep
181,Full Stack Data Science Bootcamp 2.0 With Job Guaranteed Course Announcement,2022-09-06,18222,378,18222,Sep
182,Messages From Our Students -Teachers Day@Telusko @saurabhexponent1 @HiteshChoudharydotcom @MahatmajiTechnical,2022-09-06,4495,125,4495,Sep
183,Neuro Lab Launch Celebration- Live 7PM,2022-09-05,8021,336,8021,Sep
184,Announcing NeuroLab- World's First Free Community Coding Platform Ft: @iNeuroniNtelligence,2022-09-05,128873,1040,128873,Sep
185,Complete RoadMap To Learn Computer Vision,2022-09-04,28997,974,28997,Sep
186,Hyperparameter Tuning Using Machine Learning Pipelines,2022-09-03,11765,370,11765,Sep
187,Solve this Data Science Interview Question From Product Based Company,2022-09-02,9353,248,9353,Sep
188,"FAANG Interview DSA Series-Heap Sort,Binary Tree,Min Heap and Max Heap Tree AND Interview Questions",2022-09-02,6115,149,6115,Sep
189,Implementing Machine Learninng Pipelines USsing Sklearn And Python,2022-09-01,33550,1368,33550,Sep
190,"FAANG DSA Series-Discussing Sorting Algorithms-Selection, Bubble and Insertion Sort- Ft Priya Bhatia",2022-08-31,4991,119,4991,Aug
191,"End To End Machine Learning Project Implementation With Dockers,Github Actions And Deployment",2022-08-30,219861,5221,219861,Aug
192,How To Prepare And Overcome Fear In Maths For Data Science- Follow This Approach,2022-08-29,8577,295,8577,Aug
193,DSA-Discussing All Search Algorithms With Interview Based Questions- Ft: Priya Bhatia,2022-08-28,19164,383,19164,Aug
194,Trackersheet That Can Make You From Zero To HERO In Data Science,2022-08-27,18733,1051,18733,Aug
195,Cracking Data Science Interview Is Easy By This Approach!! Solve this Problem,2022-08-26,23862,802,23862,Aug
196,Just Watch!!,2022-08-25,8261,596,8261,Aug
197,Meet My Son Krishiv Naik @krishivnaikvlogs8998,2022-08-24,30149,1839,30149,Aug
198,Biral Video- Too Much Automation #shorts,2022-08-24,43800,1226,43800,Aug
199,Quick CheatSheet To Prepare For Statistics For Data Analyst And Data Scientist,2022-08-23,19953,1155,19953,Aug
200,How To Get 1cr Data Scientist Package?,2022-08-22,23425,1219,23425,Aug
201,Data Science Mock Interview iNeuron FSDS Batch With Feedbacks,2022-08-21,18558,471,18558,Aug
202,Use This Way Of Training Machine Learning Models For Efficiency,2022-08-20,33303,1749,33303,Aug
203,3 Months Updated RoadMap To Learn Machine Learning With Videos And Materials,2022-08-19,20506,841,20506,Aug
204,Day 11-Advance NLP Series-Bidirectional LSTM Intuition And Implementation Deep Learning|Krish Naik,2022-08-17,17638,514,17638,Aug
205,Huge Announcement-Access 250+ Recorded And Live Tech Courses For Lifetime-Limited Offer,2022-08-17,5717,162,5717,Aug
206,Visualizing High Dimension Data Using UMAP Is A Piece Of Cake Now,2022-08-16,17467,741,17467,Aug
207,This Independence Day- Huge Announcement- Lifetime Offer  Tech Neuron,2022-08-15,10572,293,10572,Aug
208,Advance NLP Series Announcement- Happy 76th Independence Day,2022-08-15,8871,394,8871,Aug
209,DSA Series-Lets Become a Pro In Queues Data Structures,2022-08-14,4199,129,4199,Aug
210,DSA Series-Lets Become a Pro In Stacks Data Structures,2022-08-12,7978,213,7978,Aug
211,How I Easily Optimized My Blogging Website In Minutes With 10Web Booster,2022-08-11,2960,68,2960,Aug
212,Automate EDA And Python Coding Using Mito Library,2022-08-11,8493,329,8493,Aug
213,Let's Crack Any Data Structures And Algorithms Interviews- Amazing Announcement,2022-08-09,11919,526,11919,Aug
214,Can You Solve These Data Science Usecases?,2022-08-08,7872,322,7872,Aug
215,General Doubts And Queries Everybody Have Before Starting Data Science ML And AI,2022-08-02,8434,257,8434,Aug
216,History Of Machine Learning- Dicussing The Entire Timeline,2022-07-31,256280,598,256280,Jul
217,You Need Not Learn Everything In Data Science- Honest Talks,2022-07-30,17358,771,17358,Jul
218,Getting Started With Dockers- All Basics Command Covered In 1 Video,2022-07-30,8512,191,8512,Jul
219,Out Of Bag Evaluation(OOB) And OOB Score Or Error In Random Forest,2022-07-27,9213,232,9213,Jul
220,Part 3-Git And Github Series- Resolving Git Branch Merge Conflicts In Simple Steps With Commands,2022-07-26,7357,203,7357,Jul
221,How To Deploy Machine Learning Models Using Docker And Github Action In Heroku,2022-07-25,32494,1094,32494,Jul
222,"Part 2-Git And Github Series- Git Merge,Push, Checkout And Log With Commands",2022-07-24,10231,229,10231,Jul
223,"Part 1-Git And Github Series- Introduction, Installation Of Git And Understanding Basic Commands",2022-07-23,39149,687,39149,Jul
224,How To Apply Jobs From iNeuron Job Portal,2022-07-21,6449,182,6449,Jul
225,Announcing iNeuron Job Portal-Now Start Applying Jobs,2022-07-19,13740,510,13740,Jul
226,Day 10- LSTM Practical Implementation In NLP Application|Krish Naik,2022-07-18,18012,605,18012,Jul
227,Live Q&A Ask Anything,2022-07-17,5086,246,5086,Jul
228,Blockchain Hackathon 5.0 In Collaboration With Neo @iNeuroniNtelligence  @Telusko,2022-07-17,3015,64,3015,Jul
229,Live Q&A Ask Anything,2022-07-11,8855,353,8855,Jul
230,Can We Have Multiple Constructors In Python?,2022-07-10,8868,311,8868,Jul
231,Announcing Job Guaranteed Full Stack Javascript Web Developer @HiteshChoudharydotcom |July 10th,2022-07-04,7229,130,7229,Jul
232,600k Subscriber Live Celebration,2022-07-03,7047,293,7047,Jul
233,Announcing Job Guaranteed Big Data Bootcamp @iNeuroniNtelligence @shashank_mishra,2022-07-02,14523,312,14523,Jul
234,Day 9-Word Embedding Layer And LSTM Practical Implementation In NLP Application|Krish Naik,2022-07-01,26010,860,26010,Jul
235,Day 8-LSTM Recurrent Neural Network In Depth Intuition And NLP Application|Krish Naik,2022-06-29,20216,658,20216,Jun
236,Biggest Announcement In Techneuron OTT Platform @iNeuroniNtelligence,2022-06-29,7670,242,7670,Jun
237,Day 7-BackPropogration In Recurrent Neural Network And NLP Application|Krish Naik,2022-06-28,16763,600,16763,Jun
238,Day 6-Recurrent Neural Network Indepth Intuition And NLP Application|Krish Naik,2022-06-27,23779,876,23779,Jun
239,AI/ML Live Hackathon @iNeuron,2022-06-25,49755,949,49755,Jun
240,Pro Tips For Data Science Interviews- Part 1,2022-06-24,9045,461,9045,Jun
241,Day 5-Training Word2Vec From Scratch And AvgWord2vec Indepth Inutuition|Krish Naik,2022-06-22,28039,740,28039,Jun
242,Hackathon 3.0 In Collaboration With Mu Sigma,2022-06-22,4931,160,4931,Jun
243,"Live Day 4-Word Embedding, CBOW And Skipgram Word2vec NLP And Quiz-5000Inr Give Away",2022-06-20,46987,1085,46987,Jun
244,Complete Statistics For Data Science In 6 hours By Krish Naik,2022-06-19,447485,10056,447485,Jun
245,Live Full Stack Data Analytics With Job Assistance Batch Live Induction,2022-06-18,9191,233,9191,Jun
246,Live Day 3- TF-IDF With Practical Application NLP And Quiz-5000Inr Give Away,2022-06-17,33688,1195,33688,Jun
247,Upcoming Affordable Tech Courses From @iNeuroniNtelligence,2022-06-16,7377,218,7377,Jun
